title,publication_date,source,country,summary,url,language
Los grandes momentos de la España del último medio siglo: un buen libro para este momento,"Mon, 14 Apr 2025 03:30:00 GMT",El País (Spain),Spain,La recopilación de más de un centenar de artículos de Juan Antonio Ortega Díaz-Ambrona ofrece un muy pertinente repaso a la historia de los últimos 62 años y a cuestiones que hoy nos siguen preocupando,https://elpais.com/babelia/2025-04-14/los-grandes-momentos-de-la-espana-del-ultimo-medio-siglo-un-buen-libro-para-este-momento.html,es
"Muffins ingleses, los panecillos de desayuno que se cocinan en la sartén","Mon, 21 Apr 2025 03:00:00 GMT",El País (Spain),Spain,"La masa de los ‘english muffins’ es tierna y aireada, perfecta para acompañar ingredientes dulces o salados. Nuestra versión de la receta tiene una gran ventaja: apenas requiere amasado",https://elpais.com/gastronomia/el-comidista/2025-04-21/muffins-ingleses-los-panecillos-de-desayuno-que-se-cocinan-en-la-sarten.html,es
"La Jaula de los 3 Grillos, el restaurante donde todo tiene una historia","Sat, 19 Apr 2025 03:00:00 GMT",El País (Spain),Spain,Cerca del puerto de Gijón se alza un local donde los recuerdos de distintas generaciones están en los platos y en las paredes. ¿Una enmienda a la totalidad al minimalismo moderno?,https://elpais.com/gastronomia/el-comidista/2025-04-19/la-jaula-de-los-3-grillos-el-restaurante-donde-todo-tiene-una-historia.html,es
De fábricas a hogares: la nueva vida de las naves industriales para paliar la crisis de la vivienda,"Wed, 16 Apr 2025 03:00:00 GMT",El País (Spain),Spain,"La transformación de espacios inutilizados tiene el potencial de crear hasta 20 millones de nuevos hogares en Europa en los próximos 15 años, según un estudio",https://elpais.com/proyecto-tendencias/2025-04-16/de-fabricas-a-hogares-la-nueva-vida-de-las-naves-industriales-para-paliar-la-crisis-de-la-vivienda.html,es
Primeros datos sobre la manipulación de masas por IA,"Fri, 11 Apr 2025 03:00:00 GMT",El País (Spain),Spain,Se puede averiguar cuándo una web empieza a usar la inteligencia artificial generativa por el mero incremento explosivo y alcance amplio de los artículos,https://elpais.com/proyecto-tendencias/2025-04-11/primeros-datos-sobre-la-manipulacion-de-masas-por-ia.html,es
Los Lenovo Days han vuelto: nueve ofertas especiales en portátiles y tabletas,"Tue, 22 Apr 2025 05:00:00 GMT",El País (Spain),Spain,No dejes escapar los mejores descuentos de esta primavera en la web de Lenovo con ahorros de hasta 700 euros en sus dispositivos más vendidos,https://elpais.com/escaparate/ofertas-y-descuentos/2025-04-22/lenovo-days-ofertas-portatiles.html,es
"La batidora amasadora retro que hace helados de textura única, ahora rebajada","Tue, 22 Apr 2025 05:00:00 GMT",El País (Spain),Spain,"Este aparato mezclador es un aliado básico en la cocina para lograr con éxito todo tipo de masas, mezclas, rellenos y salsas en nuestras elaboraciones reposteras",https://elpais.com/escaparate/ofertas-y-descuentos/2025-04-22/batidora-amasadora-cecotec.html,es
El zapato de tacón superventas en 12 colores que no querrás quitarte esta primavera,"Tue, 22 Apr 2025 05:00:00 GMT",El País (Spain),Spain,Un calzado clásico y cómodo que cuenta con cierre de hebilla y más de 10.800 valoraciones en Amazon,https://elpais.com/escaparate/estilo-de-vida/2025-04-22/zapatos-de-tacon-clasicos.html,es
Necesitas este sérum anticaída de Kérastase para cabellos frágiles: es el más vendido,"Tue, 22 Apr 2025 05:00:00 GMT",El País (Spain),Spain,"Pertenece a la gama Genesis, el tratamiento favorito de las expertas para recuperar la fortaleza natural de la melena",https://elpais.com/escaparate/belleza/2025-04-22/kerastase-serum-anticaida.html,es
Los mejores portatrajes de viaje baratos,"Tue, 22 Apr 2025 05:00:00 GMT",El País (Spain),Spain,"Comparamos cuatro fundas para proteger la ropa contra arrugas, manchas y polvo, con el fin de encontrar la más sobresaliente",https://elpais.com/escaparate/comparativas/2025-04-22/mejores-portatrajes-de-viaje-baratos.html,es
"Education, health fees among key concerns",2017-12-12T00:59:00.000+0000,China Daily (China),China,China to legislate on preschool education,http://www.chinadaily.com.cn/a/201712/12/WS5a2f29d4a3108bc8c6721a30.html,en
International group praises green revival,2017-12-12T00:46:57.000+0000,China Daily (China),China,A high-level international advisory body applauded China's efforts to improve the environment and suggested a 15-year strategy against pollution in a draft recommendation report on Monday.,http://www.chinadaily.com.cn/a/201712/12/WS5a2f2701a3108bc8c6721a16.html,en
"Beijing, Moscow drill for potential missile warfare",2017-12-12T00:41:33.000+0000,China Daily (China),China,"China and Russia kicked off their second joint computer-assisted anti-missile drill on Monday, a move experts said could deter potential missile threats amid rising tensions on the Korean Peninsula.",http://www.chinadaily.com.cn/a/201712/12/WS5a2f25bda3108bc8c6721a0b.html,en
"Memorial Day a time to 'remember', 'inspire'",2017-12-12T00:39:08.000+0000,China Daily (China),China,A memorial service to mark the 80th anniversary of the Nanjing Massacre committed during the War of Resistance Against Japanese Aggression (1931-45) brought together hundreds of activists and members of the Chinese and other Asian communities on Sunday in San Francisco.,http://www.chinadaily.com.cn/a/201712/12/WS5a2f252ca3108bc8c6721a01.html,en
More military technologies targeted for civilian sector to boost economy,2017-12-12T00:38:44.000+0000,China Daily (China),China,"China will strengthen innovation by developing high-tech industries with military technologies to boost military-civil integration, a move that aims to cultivate new growth drivers and boost the economy, said a recent State Council guideline.",http://www.chinadaily.com.cn/a/201712/12/WS5a2f2514a3108bc8c67219fb.html,en
Dangerous stunts get thumbs-down from video platforms,2017-12-12T00:36:10.000+0000,China Daily (China),China,Multiple social media and video streaming platforms will limit who can view videos that depict dangerous stunts - and may even prohibit such material - in an effort to discourage imitators.,http://www.chinadaily.com.cn/a/201712/12/WS5a2f247aa3108bc8c67219f5.html,en
Taiwan's New Party vows to help improve relations,2017-12-12T00:33:47.000+0000,China Daily (China),China,"Top political adviser Yu Zhengsheng met with a Taiwan delegation representing the island's New Party in Beijing on Monday to discuss the peaceful development of cross-Straits relations and how to achieve the ""great rejuvenation"" of the Chinese nation.",http://www.chinadaily.com.cn/a/201712/12/WS5a2f23eba3108bc8c67219f0.html,en
Former Chongqing political official facing corruption investigation,2017-12-12T00:28:27.000+0000,China Daily (China),China,"Sun Zhengcai, the former secretary of Chongqing Municipal Committee of the Communist Party of China, has been placed under investigation on suspicion of accepting bribes, according to the Supreme People's Procuratorate on Monday.",http://www.chinadaily.com.cn/a/201712/12/WS5a2f22aba3108bc8c67219e2.html,en
Satellite lofted for first Arab country,2017-12-12T00:27:08.000+0000,China Daily (China),China,"A Chinese-made communications satellite became the first ""export"" of such a spacecraft to an Arab country when it was launched by China on Monday for Algeria.",http://www.chinadaily.com.cn/a/201712/12/WS5a2f225ea3108bc8c67219dd.html,en
Water diversion project drives environmental improvements and provides new jobs for locals,2017-12-11T23:57:57.000+0000,China Daily (China),China,Green industries such as eco-agriculture and tourism are helping to raise living standards along the program's central route,http://www.chinadaily.com.cn/a/201712/12/WS5a2f1b86a3108bc8c672199a.html,en
Oldest Nanjing Massacre survivor dies at 100,2017-12-11T23:32:01.000+0000,China Daily (China),China,"The oldest survivor of the Nanjing Massacre died on Sunday, and fewer than 100 survivors remain, the Memorial Hall of the Victims in the Nanjing Massacre said on Monday.",http://www.chinadaily.com.cn/a/201712/12/WS5a2f1571a3108bc8c6721964.html,en
AIIB loans $250m for Beijing coal-to-gas conversion,2017-12-11T23:27:38.000+0000,China Daily (China),China,"The Asian Infrastructure Investment Bank announced on Monday a $250 million loan for a natural gas project in Beijing, the bank's first such investment in China, to help cut coal use and improve air quality in the capital area.",http://www.chinadaily.com.cn/a/201712/12/WS5a2f146aa3108bc8c6721954.html,en
Discovering Yunnan’s Tibetan Plateau - A personal Shangri-La,2017-12-11T23:09:44.000+0000,China Daily (China),China,"High in the northwestern uplands of Yunnan lies a popular destination known as Shangri-La since 2001. When Bruce Connolly visited it in 1995, it was called Zhongdian. A town partly fulfilling Bruce’s Tibetan dream.",http://www.chinadaily.com.cn/a/201712/12/WS5a2f103aa3108bc8c672193a.html,en
Xi: Uproot undesirable work styles,2017-12-11T21:51:37.000+0000,China Daily (China),China,"General Secretary Xi Jinping warns about the recurrence of undesirable work styles - formalities for formalities' sake, hedonism, and extravagance.",http://www.chinadaily.com.cn/a/201712/12/WS5a2efdeaa3108bc8c6721925.html,en
Xi-style diplomacy brings China closer to world,2017-12-11T14:39:19.000+0000,China Daily (China),China,,http://www.chinadaily.com.cn/a/201712/11/WS5a2e9898a3103f77d55ac36d.html,Unknown
China to hold annual memorial for Nanjing Massacre victims,2017-12-11T13:08:34.000+0000,China Daily (China),China,"China will hold an annual memorial for the victims of the Nanjing Massacre, in the eastern city of Nanjing Wednesday.",http://www.chinadaily.com.cn/a/201712/11/WS5a2e8352a3103f77d55ac363.html,en
Beijing’s Haidian district halts removal of building signs,2017-12-11T12:52:36.000+0000,China Daily (China),China,"Urban management authorities in Beijing’s Haidian district have suspended the removal of signs and billboards from buildings, and have not made a decision when work would resume.",http://www.chinadaily.com.cn/a/201712/11/WS5a2e7f94a3103f77d55ac35d.html,en
PLA Navy stations women on Nansha Islands for the 1st time,2017-12-11T12:33:50.000+0000,China Daily (China),China,"The People’s Liberation Army has sent 10 of its female members to join the garrison guarding the Nansha Islands in the South China Sea, according to the PLA Navy.",http://www.chinadaily.com.cn/a/201712/11/WS5a2e7b2ea3109f488237c972.html,en
Forum tackles urban problems for sustainable future,2017-12-11T12:21:19.000+0000,China Daily (China),China,A forum tackling the more challenging problems in urban development gathered people in this area on Saturday to raise awareness of greener and more sustainable urban development.,http://www.chinadaily.com.cn/a/201712/11/WS5a2e7840a3109f488237c96c.html,en
Emojis frown on corruption,2017-12-11T11:59:50.000+0000,China Daily (China),China,An emojis package highlighting the eight-point austerity rules has become a hit on the internet.,http://www.chinadaily.com.cn/a/201712/11/WS5a2e7338a3109f488237c969.html,en
Suzhou police catch gang selling fake Herbalife products,2017-12-11T11:43:01.000+0000,China Daily (China),China,Police in eastern China said on Monday they have smashed an operation that made more than 20 million yuan ($3 million) from selling fake Herbalife products.,http://www.chinadaily.com.cn/a/201712/11/WS5a2e6f45a3109f488237c967.html,en
Jack Ma Foundation pledges millions to boost rural education,2017-12-11T11:32:54.000+0000,China Daily (China),China,The Jack Ma Foundation has pledged to spend at least 300 million yuan ($45 million) in the next decade to staff rural schools with qualified teachers.,http://www.chinadaily.com.cn/a/201712/11/WS5a2e6ce6a3109f488237c965.html,en
New Party delegation from Taiwan visits mainland,2017-12-11T11:21:27.000+0000,China Daily (China),China,The director of the State Council's Taiwan Affairs Office met with a delegation from Taiwan's New Party on Monday to promote peaceful development of cross-Straits relations.,http://www.chinadaily.com.cn/a/201712/11/WS5a2e6a39a3109f488237c814.html,en
NGO helps epileptic boy realize racing dream in Zhejiang,2017-12-11T10:49:59.000+0000,China Daily (China),China,An NGO helped an epileptic boy from eastern China realize his dream to ride a race car on an international circuit on Monday.,http://www.chinadaily.com.cn/a/201712/11/WS5a2e62d8a3109f488237c209.html,en
Six killed in Hebei bath house fire,2017-12-11T10:39:59.000+0000,China Daily (China),China,"Six people were killed on Sunday afternoon in a fire at a bath house in Yongnian district of Handan, Hebei province, authorities said on Monday.",http://www.chinadaily.com.cn/a/201712/11/WS5a2e6080a3109f488237c032.html,en
Residents mobilized to protect environment in Tibet,2017-12-11T08:50:59.000+0000,China Daily (China),China,"Residents of southwest China's Tibet autonomous region have been mobilized for government-paid patrolling jobs to protect the ecosystem on the ""roof of the world.""",http://www.chinadaily.com.cn/a/201712/11/WS5a2e46f3a310eefe3e9a2fe0.html,en
Israeli feels special connection to Harbin,2017-12-11T08:45:31.000+0000,China Daily (China),China,"A young foreign man walks around the city, giving big hugs to the strangers he meets on the streets in Harbin, capital of Northeast China’s Heilongjiang province.",http://www.chinadaily.com.cn/a/201712/11/WS5a2e45aca310eefe3e9a2efe.html,en
Honor mobile phone leading in AI speed,2017-12-11T08:36:40.000+0000,China Daily (China),China,Many commentators have deemed 2017 to be year one for the artificial intelligence smartphone as iPhone X and Honor V10 launched into the highly competitive but uniform cellphone market. So will an intelligent phone be the next great breakthrough?,http://www.chinadaily.com.cn/a/201712/11/WS5a2e4398a310eefe3e9a2ee3.html,en
Xi’an security guard dies trying to save suicidal woman,2017-12-11T07:54:49.000+0000,China Daily (China),China,"Police in Xi’an, Shaanxi province, are investigating the death of a security guard who tried to catch a woman who jumped from the 11th floor of a building, Huashang Daily reported on Monday.",http://www.chinadaily.com.cn/a/201712/11/WS5a2e39c9a310eefe3e9a2ed4.html,en
'Naughty' elephant damages two vehicles in SW China,2017-12-11T06:44:17.000+0000,China Daily (China),China,"A wild Asian elephant turned a highway in southwest China's Yunnan province into its playground, damaging a minibus and a sedan Saturday afternoon.",http://www.chinadaily.com.cn/a/201712/11/WS5a2e2941a310eefe3e9a290b.html,en
"Algerian boy, 12, wins Shenzhen talent contest",2017-12-11T05:51:21.000+0000,China Daily (China),China,A 12-year-old Algerian boy was crowned winner of the eighth Shenzhen Expats Chinese Talent Competition on Sunday.,http://www.chinadaily.com.cn/a/201712/11/WS5a2e1cd9a310eefe3e9a28ac.html,en
Duke Kunshan starts search for bachelor’s degree students,2017-12-11T05:51:07.000+0000,China Daily (China),China,"Duke Kunshan University, a joint venture between Duke University in the US and China’s Wuhan University, has started to enroll its first class of undergraduate students.",http://www.chinadaily.com.cn/a/201712/11/WS5a2e1ccba310eefe3e9a28a8.html,en
Former Chongqing Party chief under investigation,2017-12-11T05:13:51.000+0000,China Daily (China),China,"Sun Zhengcai, the former Party chief of Chongqing, is being investigated on allegations of bribery, State prosecutors said on Monday.",http://www.chinadaily.com.cn/a/201712/11/WS5a2e1410a310eefe3e9a2754.html,en
Top procuratorate investigates Sun Zhengcai,2017-12-11T04:06:18.000+0000,China Daily (China),China,"The Supreme People's Procuratorate (SPP) of China announced on Monday that it has started investigation into Sun Zhengcai, former secretary of Chongqing Municipal Committee of the Communist Party of China (CPC).",http://www.chinadaily.com.cn/a/201712/11/WS5a2e043aa310eefe3e9a2745.html,en
Xi stresses nonstop efforts to fight undesirable work styles,2017-12-11T03:38:58.000+0000,China Daily (China),China,"Xi Jinping, general secretary of the Communist Party of China Central Committee, stressed that the fight against undesirable work styles should not be stopped.",http://www.chinadaily.com.cn/a/201712/11/WS5a2dfdd2a310eefe3e9a273a.html,en
World's largest automated container terminal starts operation in Shanghai,2017-12-11T03:20:15.000+0000,China Daily (China),China,"As part of the Shanghai Free Trade Zone, the system can operate completely unmanned.",http://www.chinadaily.com.cn/a/201712/11/WS5a2df96fa310eefe3e9a2716.html,en
China launches communication satellite for Algeria,2017-12-11T02:33:57.000+0000,China Daily (China),China,"China launched Algeria's first communication satellite, Alcomsat-1, into a preset orbit from the Xichang Satellite Launch Center in the southwestern province of Sichuan early Monday.",http://www.chinadaily.com.cn/a/201712/11/WS5a2dee96a310eefe3e9a163a.html,en
"Chinese, Algerian presidents hail successful launch of communications satellite",2017-12-11T02:18:49.000+0000,China Daily (China),China,President Xi Jinping and his Algerian counterpart Abdelaziz Bouteflika exchanged congratulatory messages on the successful launch of Alcomsat-1 in the Xichang Satellite Launch Center in China's southwestern province of Sichuan early Monday.,http://www.chinadaily.com.cn/a/201712/11/WS5a2deb0aa310eefe3e9a1614.html,en
Autopsy: Jiang suffered several injuries before the fatal stab,2017-12-11T02:12:40.000+0000,China Daily (China),China,The trial of the alleged murderer of Chinese student Jiang Ge began at 10 am on Monday in Tokyo. It will last seven days and the verdict is expected on Dec 20.,http://www.chinadaily.com.cn/a/201712/11/WS5a2de998a310eefe3e9a160b.html,en
Asia's tallest wooden pagoda destroyed,2017-12-11T02:11:46.000+0000,China Daily (China),China,The 16-story structure was said to be the tallest wooden pagoda in Asia. No casualties were reported in the incident. The cause of the blaze is under investigation.,http://www.chinadaily.com.cn/a/201712/11/WS5a2de962a310eefe3e9a1600.html,en
Guizhou: Western province looks to the future of big data,2017-12-11T01:22:18.000+0000,China Daily (China),China,"While located in the remote southwestern part of China, Guizhou leads the development of Big Data technology in recent years.",http://www.chinadaily.com.cn/a/201712/11/WS5a2dddcaa310eefe3e9a159a.html,en
