title,publication_date,source,country,summary,url,language
"Who is Cardinal Kevin Farrell, the acting head of the Vatican?","Mon, 21 Apr 2025 23:51:19 GMT",BBC (UK),United Kingdom,The cardinal will oversee the Vatican until a new pontiff is elected.,https://www.bbc.com/news/articles/cly1md6r3l8o,en
Final days of Pope who joined Vatican crowds at Easter despite doctors' advice,"Mon, 21 Apr 2025 18:48:18 GMT",BBC (UK),United Kingdom,"Francis did what he had always done, receiving visitors and meeting people from every walk of life.",https://www.bbc.com/news/articles/c20xd9xnp0wo,en
"Francis was a vocal critic of the powerful, his influence felt far beyond faith","Mon, 21 Apr 2025 14:19:34 GMT",BBC (UK),United Kingdom,"The informal Pope aimed to shift influence from Rome into hands of the faithful, the BBC's Aleem Maqbool writes.",https://www.bbc.com/news/articles/c15v0zdnnjqo,en
"I felt BBC wanted me to leave Match of the Day, says Gary Lineker","Mon, 21 Apr 2025 23:04:10 GMT",BBC (UK),United Kingdom,"The presenter is stepping down from the football show, but will still host World Cup and FA Cup coverage.",https://www.bbc.com/news/articles/cp3116660g4o,en
US stocks and dollar plunge as Trump attacks Fed chair Powell,"Tue, 22 Apr 2025 06:34:50 GMT",BBC (UK),United Kingdom,"The president amps up attack against US central bank boss calling him ""a major loser"" for not lowering interest rates.",https://www.bbc.com/news/articles/ce92y3j9v34o,en
Nationalities of foreign criminals to be published,"Tue, 22 Apr 2025 06:40:48 GMT",BBC (UK),United Kingdom,Data is due to be released by the year's end showing nationalities and crimes of those awaiting deportation.,https://www.bbc.com/news/articles/cdjln7zzz8eo,en
Mission to boldly grow food in space labs blasts off,"Tue, 22 Apr 2025 00:58:53 GMT",BBC (UK),United Kingdom,The mission will explore new ways of reducing the cost of feeding an astronaut.,https://www.bbc.com/news/articles/cp34wzql2xvo,en
"New Israel-Gaza ceasefire plan proposed, Hamas source tells BBC","Tue, 22 Apr 2025 07:05:48 GMT",BBC (UK),United Kingdom,Egyptian and Qatari mediators suggest a truce of up to seven years and a permanent end to the war.,https://www.bbc.com/news/articles/c62xnqlj11lo,en
The Vivienne hid ketamine struggle 'to protect family',"Tue, 22 Apr 2025 05:02:36 GMT",BBC (UK),United Kingdom,James Lee Williams' sister says the family only learned of the drag performer's drug problem after watching Drag Race UK.,https://www.bbc.com/news/articles/c5y5e7y8qv0o,en
Putin suggests Russia open to direct talks with Ukraine,"Tue, 22 Apr 2025 04:04:19 GMT",BBC (UK),United Kingdom,The Russian president's proposal is the first signal of bilateral talks since the early days of the war.,https://www.bbc.com/news/articles/cpq7ywvw1lzo,en
Harvard sues Trump administration over funding freeze,"Mon, 21 Apr 2025 22:11:28 GMT",BBC (UK),United Kingdom,The suit is part of a feud that escalated when the institution rejected a list of demands from the Trump administration.,https://www.bbc.com/news/articles/c4grwkyxgjwo,en
"US sets tariffs of up to 3,521% on South East Asia solar panels","Tue, 22 Apr 2025 06:49:22 GMT",BBC (UK),United Kingdom,Several Chinese solar companies with factories across the region could face steep new tariffs.,https://www.bbc.com/news/articles/c5ygdv47vlzo,en
China executes man who stabbed Japanese school boy,"Tue, 22 Apr 2025 05:44:12 GMT",BBC (UK),United Kingdom,Zhong Changchun was sentenced to death in January for attacking the boy who later died of his injuries.,https://www.bbc.com/news/articles/c2kv93y4289o,en
Island where Stormzy wrote album on sale for £25m,"Tue, 22 Apr 2025 06:04:43 GMT",BBC (UK),United Kingdom,"Osea Island, a secluded retreat reached by a causeway, is popular with stars seeking privacy.",https://www.bbc.com/news/articles/czx410p5kxpo,en
Canada's top candidates talk up fossil fuels as climate slips down agenda,"Mon, 21 Apr 2025 23:16:49 GMT",BBC (UK),United Kingdom,"Amid tariff threats from the US, energy and economic security are key issues in Canada's federal election.",https://www.bbc.com/news/articles/c87pev3jpyyo,en
Attempts to reach ceasefire in Ukraine littered with years of failure,"Mon, 21 Apr 2025 09:05:19 GMT",BBC (UK),United Kingdom,"The 30-hour ""Easter truce"" and the reported violations underscore the difficulty in securing even a brief pause in fighting.",https://www.bbc.com/news/articles/c1wdllj8lwxo,en
The Papers:  'People's Pope' and 'Battle for Church's future',"Tue, 22 Apr 2025 04:20:48 GMT",BBC (UK),United Kingdom,"The death of Pope Francis, aged 88, dominates the front pages of the major UK papers.",https://www.bbc.com/news/articles/c87pr4710e8o,en
Could a volcanic eruption destroy a dreamy Greek island?,"Sun, 20 Apr 2025 23:59:02 GMT",BBC (UK),United Kingdom,Scientists are investigating for the first time how dangerous the island's next big one could be.,https://www.bbc.com/news/articles/cm25lz56rezo,en
Britain's nursery problem: Parents still face 'childcare deserts',"Mon, 21 Apr 2025 00:53:57 GMT",BBC (UK),United Kingdom,"Nursery places can difficult to find, particularly in certain areas - so why have successive governments not yet found a solution?",https://www.bbc.com/news/articles/c8x8rznw9gyo,en
BBC News app,"Tue, 20 Aug 2024 11:35:33 GMT",BBC (UK),United Kingdom,"Top stories, breaking news, live reporting, and follow news topics that match your interests",https://www.bbc.co.uk/news/10628994,en
The Death of the Pope,"Mon, 21 Apr 2025 19:08:00 GMT",BBC (UK),United Kingdom,Vatican says Pope Francis died of stroke and subsequent irreversible heart failure.,https://www.bbc.co.uk/sounds/play/p0l5n285,en
Pope Francis Dies - Global News Podcast Special Episode,"Mon, 21 Apr 2025 11:56:00 GMT",BBC (UK),United Kingdom,His death at 88 follows a lengthy illness,https://www.bbc.co.uk/sounds/play/p0l5l5xb,en
No ball? No problem. How Forest are breaking the possession obsession,"Mon, 21 Apr 2025 23:00:28 GMT",BBC (UK),United Kingdom,Nottingham Forest could become the first side in Premier League history to finish in the top four with less than 40% average possession.,https://www.bbc.com/sport/football/articles/c20xd10z6gvo,en
O'Sullivan's return headlines day four at Crucible,"Tue, 22 Apr 2025 05:33:41 GMT",BBC (UK),United Kingdom,Ronnie O'Sullivan's return after three months away from competitive action is the headline attraction on the fourth day at the World Championship.,https://www.bbc.com/sport/snooker/articles/cx2y5ex9d7yo,en
Will Verstappen modify his driving after penalty?,"Tue, 22 Apr 2025 06:39:20 GMT",BBC (UK),United Kingdom,BBC Sport F1 correspondent Andrew Benson answers your latest questions after the Saudi Arabian Grand Prix.,https://www.bbc.com/sport/formula1/articles/cj689lk6jzpo,en
"I felt BBC wanted me to leave Match of the Day, says Lineker","Mon, 21 Apr 2025 23:04:10 GMT",BBC (UK),United Kingdom,"The presenter is stepping down from the football show, but will still host World Cup and FA Cup coverage.",https://www.bbc.com/news/articles/cp3116660g4o,en
Inside 934 days of Eubank-Benn bitterness and chaos,"Tue, 22 Apr 2025 05:13:49 GMT",BBC (UK),United Kingdom,"BBC Sport looks back on more than 900 days of Conor Benn and Chris Eubank Jr's chaotic rivalry, which will finally reach the ring on Saturday.",https://www.bbc.com/sport/boxing/articles/c15vl27381xo,en
'It must be amazing to get a standing ovation from the Man Utd fans',"Tue, 22 Apr 2025 05:19:29 GMT",BBC (UK),United Kingdom,"Gary Lineker, Alan Shearer and Micah Richards debate the best moments in Champions League history, with their minds drifting to when Brazil's Ronaldo wowed everyone with a hat-trick at Old Trafford in 2003.",https://www.bbc.com/sport/football/videos/cewg415nvr0o,en
Trump pleads not guilty to 34 felony counts,N/A,CNN (USA),United States,N/A,https://edition.cnn.com/webview/politics/live-news/trump-indictment-stormy-daniels-news-04-03-23/index.html,Unknown
Haberman reveals why Trump attacked judge and his family in speech,"Wed, 05 Apr 2023 13:30:09 GMT",CNN (USA),United States,CNN political contributor Maggie Haberman explains the reasoning behind Donald Trump's attacks on the judge and his family during a speech at his Mar-a-Lago resort after he was arraigned on felony charges.,https://www.cnn.com/videos/politics/2023/04/05/maggie-haberman-donald-trump-speech-indictment-reaction-sot-cnntm-vpx.cnn,en
What to know about the Trump indictment on the eve of his court appearance,"Wed, 05 Apr 2023 22:50:06 GMT",CNN (USA),United States,N/A,https://www.cnn.com/collections/intl-trump-040223/,Unknown
READ: Trump indictment related to hush money payment,N/A,CNN (USA),United States,N/A,https://cnn.it/411KYN7,Unknown
Russian authorities detain suspect over St. Petersburg cafe blast,N/A,CNN (USA),United States,N/A,https://edition.cnn.com/webview/europe/live-news/russia-ukraine-war-news-04-03-23/index.html,Unknown
Video shows moment of deadly explosion at cafe in Russia,"Tue, 04 Apr 2023 01:08:44 GMT",CNN (USA),United States,"A well-known Russian military blogger, Vladlen Tatarsky, was killed in an explosion at a cafe in St. Petersburg, authorities said. CNN's Matthew Chance reports.",https://www.cnn.com/videos/world/2023/04/02/russian-military-blogger-vladlen-tatarsky-killed-cafe-explosion-chance-vpx.cnn,en
"Wall Street Journal reporter Evan Gershkovich appeals against arrest, Russian state media says","Mon, 03 Apr 2023 13:58:58 GMT",CNN (USA),United States,N/A,https://www.cnn.com/collections/intl-ukraine-030423/,Unknown
Suspected Chinese spy balloon was able to transmit information back to Beijing,"Mon, 03 Apr 2023 13:38:22 GMT",CNN (USA),United States,"The suspected Chinese spy balloon that transited the US earlier this year was able to capture imagery and collect some signals intelligence from US military sites, a source familiar with the matter tells CNN.",https://www.cnn.com/2023/04/03/politics/chinese-spy-balloon/index.html,en
Beijing promised to 'fight back' over Taiwan leader's US visit. But this time it has more to lose,"Tue, 04 Apr 2023 07:49:53 GMT",CNN (USA),United States,An anticipated meeting between Taiwan's President Tsai Ing-wen and US House Speaker Kevin McCarthy in California this week has sparked concerns of a repeat of the pressure campaign China launched last year when then-Speaker Nancy Pelosi visited Taipei.,https://www.cnn.com/2023/04/04/asia/tsai-ing-wen-taiwan-mccarthy-meeting-analysis-intl-hnk/index.html,en
"'Scary, cold, hungry and lonely': Volunteer soldier shares experience on front line","Mon, 03 Apr 2023 12:13:24 GMT",CNN (USA),United States,"A young volunteer soldier, Akula, who signed up for the war at the beginning of the Russian invasion is now dealing with the trauma of war. He spoke to CNN's David McKenzie about his time on the front lines and how it has affected his mental health.",https://www.cnn.com/videos/world/2023/04/03/soldiers-russia-ukraine-war-david-mckenzie-pkg-ovn-intl-ldn-vpx.cnn,en
The four astronauts NASA picked for the first crewed moon mission in 50 years,"Tue, 04 Apr 2023 11:44:30 GMT",CNN (USA),United States,"Astronauts who will helm the first crewed moon mission in five decades were revealed on Monday, queuing up the quartet to begin training for the historic Artemis II lunar flyby that is set to take off in November 2024.",https://www.cnn.com/2023/04/03/world/artemis-2-astronaut-crew-scn/index.html,en
French minister under fire for Playboy magazine cover,"Mon, 03 Apr 2023 11:54:59 GMT",CNN (USA),United States,French government minister Marlene Schiappa has come under fire from members of her own party after appearing on the front cover of Playboy magazine.,https://www.cnn.com/2023/04/02/europe/french-minister-playboy-cover-intl/index.html,en
Why did Finland's PM lose? Reporter explains the key issue voters cared about,"Mon, 03 Apr 2023 10:06:11 GMT",CNN (USA),United States,Finland's left-wing Prime Minister Sanna Marin conceded defeat in the country's parliamentary election as the opposition right-wing National Coalition Party claimed victory in a tightly fought contest. CNN's Laila Harrak spoke with New York Times' Chief Diplomatic Correspondent Steven Erlanger to discuss how the popular politician lost the election.,https://www.cnn.com/videos/world/2023/04/03/finland-prime-minister-sanna-marin-concedes-election-right-wing-party-wins-ovn-intl-ldn-vpx.cnn,en
Britain's pound is beating every other major currency this year,"Tue, 04 Apr 2023 18:49:31 GMT",CNN (USA),United States,"The British pound crashed to a record low last fall as investors rebelled against budget plans by former Prime Minister Liz Truss. Now, it's enjoying a comeback.",https://www.cnn.com/2023/04/04/investing/british-pound-currency-dollar/index.html,en
Finland's Prime Minister Sanna Marin concedes election,"Mon, 03 Apr 2023 10:24:55 GMT",CNN (USA),United States,Finland's left-wing Prime Minister Sanna Marin conceded defeat on Sunday in the Nordic country's parliamentary election as the opposition right-wing National Coalition Party (NCP) claimed victory in a tightly fought contest.,https://www.cnn.com/2023/04/02/europe/sanna-marin-finland-elections-concedes-intl/index.html,en
Hundreds of millions at risk from Chinese shopping app malware,N/A,CNN (USA),United States,N/A,https://cnn.it/40OSomK,Unknown
The $500 billion beauty industry's 'green' ambitions are a patchwork at best. And they're falling short,"Thu, 06 Apr 2023 20:09:14 GMT",CNN (USA),United States,"The escalating climate crisis is shifting many people's purchasing patterns and this extends to the $500 billion dollar global beauty industry which is grappling with a range of sustainability challenges across product manufacturing, packaging and disposal.",https://www.cnn.com/style/article/beauty-skincare-climate/index.html,en
A new approach to a Covid-19 nasal vaccine shows early promise,"Mon, 03 Apr 2023 19:04:07 GMT",CNN (USA),United States,"Scientists in Germany say they've been able to make a nasal vaccine that can shut down a Covid-19 infection in the nose and throat, where the virus gets its first foothold in the body.",https://www.cnn.com/2023/04/03/health/nasal-vaccine-sterilizing-immunity/index.html,en
Video shows moment man throws yogurt on two women in Iran,"Mon, 03 Apr 2023 10:17:00 GMT",CNN (USA),United States,"Video shows an incident at a store in the Iranian city of Shandiz where a man approached two unveiled women before proceeding to grab a tub of yogurt from the store and throw it, hitting both women in the head. The video then appears to show a male staff member removing the suspect from the store. CNN is not able to verify what was said immediately before the confrontation.",https://www.cnn.com/videos/world/2023/04/03/man-throws-yogurt-on-women-iran-president-raisi-hijab-is-law-nada-bashir-ovn-intl-ldn-vpx.cnn,en
"Israeli military veterans, a backbone of protest movement, vow to keep demonstrating","Mon, 03 Apr 2023 17:22:51 GMT",CNN (USA),United States,"In a sea of Israeli flags, Yiftach Golov holds one that looks a little different.",https://www.cnn.com/2023/04/03/middleeast/israel-protests-military-veterans-intl-cmd/index.html,en
Erdogan's political fate may be determined by Turkey's Kurds,"Mon, 03 Apr 2023 14:54:00 GMT",CNN (USA),United States,"Turkey's persecuted pro-Kurdish party has emerged as a kingmaker in the country's upcoming election, playing a decisive role that may just tip the balance enough to unseat two-decade ruler Recep Tayyip Erdogan.",https://www.cnn.com/2023/04/03/middleeast/kurdish-kingmaker-turkish-elections-mime-intl/index.html,en
Dogecoin jumps after Elon Musk replaces Twitter bird with Shiba Inu,"Mon, 03 Apr 2023 20:48:03 GMT",CNN (USA),United States,"Twitter's traditional bird icon was booted and replaced with an image of a Shiba Inu, an apparent nod to dogecoin, the joke cryptocurrency that CEO Elon Musk is being sued over.",https://www.cnn.com/2023/04/03/investing/dogecoin-elon-musk-twitter/index.html,en
Micron Technology: China probes US chip maker for cybersecurity risks as tech tension escalates,"Tue, 04 Apr 2023 03:17:15 GMT",CNN (USA),United States,"China has launched a cybersecurity probe into Micron Technology, one of America's largest memory chip makers, in apparent retaliation after US allies in Asia and Europe announced new restrictions on the sale of key technology to Beijing.",https://www.cnn.com/2023/04/03/tech/china-micron-probe-us-chip-war-intl-hnk/index.html,en
Man rides out tornado inside van. See the footage,"Sun, 02 Apr 2023 11:07:02 GMT",CNN (USA),United States,"Cody Coombes recounts riding out a tornado in Little Rock, Arkansas, inside his pest control van. The National Weather Service reported that an EF-3 tornado had roared through Pulaski and Lonoke counties with estimated peak winds of 165 mph, killing one person in North Little Rock and four people in Wynne.",https://www.cnn.com/videos/weather/2023/04/02/little-rock-arkansas-tornado-man-inside-van-cnntmw-vpx.cnn,en
"China Renaissance suspends trading, delays results after founder's disappearance","Mon, 03 Apr 2023 11:42:19 GMT",CNN (USA),United States,"China Renaissance, a top dealmaker in the country's tech industry, said it would suspend trading of its shares and delay the release of its annual results because it still can't get in touch with its founder.",https://www.cnn.com/2023/04/03/investing/china-renaissance-delays-results-missing-ceo-intl-hnk/index.html,en
HSBC's top execs face tense shareholders calling for a breakup,"Mon, 03 Apr 2023 12:31:48 GMT",CNN (USA),United States,"HSBC's top brass defended their strategy Monday to frustrated shareholders in the lender's largest market, as Europe's biggest bank continued to face calls to be split up.",https://www.cnn.com/2023/04/03/business/hsbc-spin-off-hk-shareholder-meeting-intl-hnk/index.html,en
Lawmaker speaks out about his struggle with depression,"Sun, 02 Apr 2023 23:11:47 GMT",CNN (USA),United States,Sen. John Fetterman (D-PA) spoke to CBS about battling with depression after winning a tight election.,https://www.cnn.com/videos/politics/2023/04/02/john-fetterman-depression-downward-spiral-acostanr-sot-vpx.cnn,en
CEOs are tired of being held responsible for gun regulation,"Mon, 03 Apr 2023 11:19:35 GMT",CNN (USA),United States,"Americans have grown used to corporate executives treading the well-worn paths of the Northeast corridor to convene alongside elected officials in Washington, DC, and discuss geopolitics, policy and all that's in-between.",https://www.cnn.com/2023/04/03/investing/premarket-stocks-trading/index.html,en
What pet cemeteries reveal about being human,"Mon, 03 Apr 2023 15:03:47 GMT",CNN (USA),United States,Why do we bury our departed loved ones in a cemetery? A primary purpose is to provide survivors with an opportunity to grieve and gain a sense of closure. The cemetery is a place for the living as much as it is a place for the dead.,https://www.cnn.com/2023/04/03/opinions/pet-cemeteries-burying-animals-history-tourigny/index.html,en
Scientists film deepest ever fish on seabed off Japan,"Tue, 18 Apr 2023 15:32:03 GMT",CNN (USA),United States,"Cruising at a depth of 8,336 meters (over 27,000 feet) just above the seabed, a young snailfish has become the deepest fish ever filmed by scientists during a probe into the abyss of the northern Pacific Ocean.",https://www.cnn.com/2023/04/03/asia/deepest-fish-filmed-off-japan-scn-intl-hnk/index.html,en
What OPEC's surprise oil cut means for gas prices,"Tue, 04 Apr 2023 01:48:26 GMT",CNN (USA),United States,OPEC and its allies' surprise move to slash oil production will soon be felt at US gas pumps.,https://www.cnn.com/2023/04/03/energy/gas-prices-opec/index.html,en
Palestinian taxi driver recounts surviving attack by right-wing protesters,"Fri, 31 Mar 2023 15:50:32 GMT",CNN (USA),United States,A Palestinian taxi driver describes surviving a violent attack by a right-wing mob in Jerusalem earlier this week as Israel continues to see protests against Prime Minister Benjamin Netanyahu's judicial overhaul spread. CNN's Nic Robertson reports.,https://www.cnn.com/videos/world/2023/03/31/israel-protests-rise-taxi-driver-attacked-robertson-pkg-intl-vpx.cnn,en
Giving Marjorie Taylor Greene a platform isn't good for America,"Mon, 03 Apr 2023 12:26:59 GMT",CNN (USA),United States,"Last year, GOP Rep. Marjorie Taylor Greene of Georgia spoke at a white nationalist event organized by Holocaust denier Nick Fuentes that caused Republican leaders to denounce her.",https://www.cnn.com/2023/04/03/opinions/60-minutes-marjorie-taylor-greene-interview-obeidallah/index.html,en
These are the animals people most want to see photographed,"Tue, 04 Apr 2023 10:38:46 GMT",CNN (USA),United States,"Originally a term used by trophy hunters in Africa, the ""Big Five"" described the animals most challenging to shoot and kill: the lion, elephant, leopard, rhino, and buffalo. Nowadays, it is more loosely used to refer to some of Africa's largest and most iconic animals.",https://www.cnn.com/travel/article/new-big-5-wildlife-photography-book-c2e-scn-spc-intl/index.html,en
"Syrian refugee elected mayor of German town, years after fleeing war","Tue, 04 Apr 2023 19:41:56 GMT",CNN (USA),United States,A Syrian who arrived in Germany as a refugee in 2015 has won a mayoral election in the southwestern German state of Baden-Württemberg.,https://www.cnn.com/2023/04/04/europe/germany-mayor-syrian-refugee-intl/index.html,en
"Study finds slightly higher risk of autism diagnosis in areas with more lithium in drinking water, but experts say more research is needed","Mon, 03 Apr 2023 18:22:12 GMT",CNN (USA),United States,"A new study found a moderately higher risk of autism spectrum disorder in children born to pregnant people exposed to tap water with higher levels of lithium, but experts caution that this association does not show a direct link between the two.",https://www.cnn.com/2023/04/03/health/autism-lithium-study/index.html,en
"Kwame Brathwaite, photographer of 'Black is Beautiful' movement, dies at 85","Tue, 04 Apr 2023 18:54:41 GMT",CNN (USA),United States,"Kwame Brathwaite, the pioneering activist and photographer whose work helped define the aesthetics of the ""Black is Beautiful"" movement of the 1960s and beyond, died on April 1, aged 85.",https://www.cnn.com/style/article/kwame-brathwaite-obituary-tan/index.html,en
This boiled bag of offal is banned in the US. In Scotland it's a fine-dining treat,"Mon, 03 Apr 2023 12:43:16 GMT",CNN (USA),United States,"Anthony Bourdain loved haggis. But even the late, great American chef, writer and television host recognized that Scotland's national dish, with its ""sinister sheep parts"" wrapped in a shroud of mystery and half-invented history, could be a hard sell.",https://www.cnn.com/travel/article/haggis-scotland-secrets/index.html,en
Musk's Twitter promised a purge of blue check marks. Instead he singled out the New York Times,"Mon, 03 Apr 2023 20:06:03 GMT",CNN (USA),United States,"Some VIP Twitter users woke up on Saturday expecting to have lost their coveted blue verification check marks in a previously announced purge by Elon Musk. Instead, Twitter appeared to target a single account from a major publication Musk dislikes and changed the language on its site in a way that obscures why users are verified.",https://www.cnn.com/2023/04/03/tech/twitter-blue-checks/index.html,en
See the world's deepest fish,"Wed, 12 Apr 2023 09:01:12 GMT",CNN (USA),United States,"Scientists captured the unknown snailfish species at a depth of more than 27,000 feet, as part of an expedition in trenches off Japan.",https://www.cnn.com/videos/travel/2023/04/03/snailfish-deepest-fish-on-camera-lon-orig-ao-cprog-scn.cnn,en
Emma Heming Willis shares family photos as daughter Mabel turns 11,"Mon, 03 Apr 2023 09:34:27 GMT",CNN (USA),United States,"Bruce Willis' wife, Emma Heming Willis, has celebrated their elder daughter's birthday with a trip down memory lane.",https://www.cnn.com/2023/04/03/entertainment/emma-willis-mabel-birthday-photos-intl-scli/index.html,en
Some fans whistle as Lionel Messi's name is announced as Paris Saint-Germain's season hits new low,"Mon, 03 Apr 2023 11:02:06 GMT",CNN (USA),United States,Paris Saint-Germain's miserable season went from bad to worse on Sunday as the team suffered a second straight home defeat with a 1-0 loss to Lyon.,https://www.cnn.com/2023/04/03/football/lionel-messi-psg-whistles-fans-spt-intl/index.html,en
Chelsea searches for new manager as Premier League breaks record for most sackings in a single season,"Mon, 03 Apr 2023 14:46:53 GMT",CNN (USA),United States,"It was just six months ago that Graham Potter was deemed the man to usher in a fresh, exciting era at Chelsea.",https://www.cnn.com/2023/04/03/football/chelsea-graham-potter-manager-premier-league-spt-intl/index.html,en
See 'Star Wars' legend react to Acosta's Darth Vader impression,"Sun, 02 Apr 2023 01:18:16 GMT",CNN (USA),United States,"Actor Mark Hamill joins CNN's Jim Acosta to discuss his thoughts about a potential spinoff series based around his legendary ""Star Wars"" character Luke Skywalker.",https://www.cnn.com/videos/media/2023/04/02/mark-hamill-star-wars-jim-acosta-skywalker-cprog-acostanr-vpx.cnn,en
Angel Reese defends gesture directed towards Caitlin Clark after LSU national title win; calls out double standard after being 'unapologetically' her,"Mon, 03 Apr 2023 18:34:35 GMT",CNN (USA),United States,"LSU star Angel Reese defended the gesture she aimed at Iowa Hawkeyes' Caitlin Clark near the end of the Tigers' first NCAA women's basketball national championship victory on Sunday, saying ""I don't take disrespect lightly.""",https://www.cnn.com/2023/04/03/sport/angel-reese-gesture-caitlin-clark-lsu-iowa-spt-intl/index.html,en
