title,publication_date,source,country,summary,url,language
"Homem mata mulher e enteada a facadas no RS, diz polícia; menina de 9 anos pulou de sacada para fugir","Mon, 21 Apr 2025 22:55:31 -0000",Globo (Brazil),Brazil,"<img src=""https://s2-g1.glbimg.com/F0R-0sw_BI_OJZlDm3z6Hk906AU=/i.s3.glbimg.com/v1/AUTH_59edd422c0c84a879bd37670ae4f538a/internal_photos/bs/2025/r/k/33SALUSjAPA8xvaNaUng/5238516-6ab7a65b4c4e566.jpg"" /><br />     Vítimas foram identificadas como Leobaldina Rocha Lyrio, 41 anos, e Diênifer Rauani Lyrio Gonçalves, de 14 anos. O homem é Juliano Henn, 49 anos. Crime ocorreu em Ronda Alta, na Região Norte do estado
Cristiano Junkherr/Agência RBS
Um homem de 49 anos matou a companheira e a enteada a facadas nesta segunda-feira (21) em Ronda Alta, na Região Norte do RS, de acordo com a polícia. Depois do crime, o suspeito tirou a própria vida, segundo a investigação.
📲 Acesse o canal do g1 RS no WhatsApp
As vítimas foram identificadas como Leobaldina Rocha Lyrio, 41 anos, e a filha dela, Diênifer Rauani Lyrio Gonçalves, de 14 anos. O homem é Juliano Henn.
Os corpos estavam dentro do apartamento onde a família morava. A Polícia Civil trabalha com a hipótese de feminicídio seguido de suicídio.
Menina teria presenciado agressões
Conforme a polícia, uma outra filha de Leobaldina, uma criança de 9 anos, teria presenciado o crime e pulou da sacada do primeiro andar do prédio para fugir do padrasto. A menina não se feriu na queda e está em segurança na casa de amigos da família.
Pedidos de medidas protetivas poderão ser feitos online no RS
A criança teria relatado aos policiais que o casal começou a discutir, e Diênifer foi atingida por golpes de faca ao tentar defender a mãe. Segundo a Brigada Militar (BM), não havia registro e histórico de violência entre o casal.
Leobaldina e Juliano moravam no local desde dezembro de 2024 e estavam juntos há pelo menos um ano. Vizinhos ouvidos pela RBS TV se disseram surpresos com o crime.
Menina de 9 anos pulou de sacada em busca de proteção.
Cristiano Junkheer/ Agência RBS
Denuncie violência doméstica
Se a ocorrência estiver em andamento, a vítima de violência ou qualquer pessoa deve ligar para o 190, o número da Brigada Militar.
Se a violência já aconteceu, a vítima deve ir na Delegacia da Mulher ou em qualquer delegacia para fazer o boletim de ocorrência e pedir medidas protetivas (localize uma delegacia aqui). Também é possível registrar uma ocorrência e pedir medida protetiva pela Delegacia Online.
A Central de Atendimento à Mulher funciona 24 horas pelo 180. A Defensoria Pública atende pelo telefone 0800-644-5556 e dá orientações sobre direitos e consulta a advogados.
Medidas protetivas poderão ser pedidas on-line no RS
VÍDEOS: Tudo sobre o RS",https://g1.globo.com/rs/rio-grande-do-sul/noticia/2025/04/21/mulher-enteada-mortas-facadas-ronda-alta-rs.ghtml,pt
Prazo para pagamento do IPTU vence nesta terça-feira em Bauru,"Mon, 21 Apr 2025 22:54:06 -0000",Globo (Brazil),Brazil,"<img src=""https://s2-g1.glbimg.com/YYxVmxDL_PqYTQ_Vh2jAbWYD4CQ=/i.s3.glbimg.com/v1/AUTH_59edd422c0c84a879bd37670ae4f538a/internal_photos/bs/2024/9/N/Bfvv7AQ8K2oZsvGvlAPw/novo-projeto-2-.png"" /><br />     Pagamentos à vista e da primeira parcela, que venciam no dia 15 de abril, foram prorrogados para o dia 22. Confira o calendário completo. Prazo para pagamento do IPTU vence nesta terça-feira em Bauru
Contribuintes de Bauru (SP)  têm até esta terça-feira (22) para pagar o IPTU à vista ou a primeira parcela do imposto. O prazo original, que era 15 de abril, foi estendido pela prefeitura após instabilidades no sistema de emissão de boletos.
📲 Participe do canal do g1 Bauru e Marília no WhatsApp
Os descontos foram mantidos. Quem optou pelo IPTU Digital ainda garante 10% de abatimento, e quem escolheu o carnê físico tem 5% de desconto no pagamento à vista.
Os contribuintes que vão realizar o pagamento no prazo estendido devem entrar no site da prefeitura e emitir um novo boleto.
Prazo para pagamento do IPTU vence nesta terça-feira em Bauru
Isabella Sousa/TV TEM
Confira o calendário completo:
Pagamento à vista
Com desconto (10% no IPTU Digital ou 5% no carnê) – Terça-feira (22);
Sem desconto – 15 de maio. 
Pagamento parcelado (sem desconto)
1ª parcela – 22/04;
2ª parcela – 15/05;
3ª parcela – 16/06;
4ª parcela – 15/07;
5ª parcela – 15/08;
6ª parcela – 15/09;
7ª parcela – 15/10;
8ª parcela – 17/11;
9ª parcela – 15/12.
Em caso de dúvidas, os contribuintes podem entrar em contato com o Plantão Fiscal, no telefone (14) 3235-1000, ramal 2, no WhatsApp (14) 3223-1514, ou no e-mail plantaofiscal@bauru.sp.gov.br. O funcionamento é das 8h às 17h de segunda a sexta-feira.
Veja mais notícias da região no g1 Bauru e Marília
VÍDEOS: assista às reportagens da região",https://g1.globo.com/sp/bauru-marilia/noticia/2025/04/21/prazo-para-pagamento-do-iptu-vence-nesta-terca-feira-em-bauru.ghtml,pt
Google enfrenta julgamento histórico por monopólio nas buscas,"Mon, 21 Apr 2025 22:50:57 -0000",Globo (Brazil),Brazil,"<img src=""https://s2-g1.glbimg.com/37XbR0JcKhiHIfinUWw_HZQrJ34=/i.s3.glbimg.com/v1/AUTH_59edd422c0c84a879bd37670ae4f538a/internal_photos/bs/2025/y/A/sKOdTcRkuTXcf3tY7w8g/2025-04-12t033035z-1375951935-rc2qb7abqikv-rtrmadp-3-tech-ai-ssi-funding.jpg"" /><br />     Resultado pode abrir caminho para desmembramento. Big tech foi derrotada em outro julgamento, na última sexta (18), desta vez sobre concorrência desleal na publicidade. Pessoas passam diante do logotipo do Google em uma feira em Hannover, na Alemanha
Annegret Hilse/Reuters
O Google começou a enfrentar um julgamento histórico nesta segunda-feira (21). O resultado poderá dar mais argumentos para que autoridades exijam o desmembramento da big tech.
O Departamento de Justiça dos Estados Unidos acusa a gigante da tecnologia de monopólio nas buscas online. E quer que o Google venda o navegador Chrome como parte de uma tentativa de restaurar a concorrência no mercado.
Na última sexta (18), em outra ação aberta pelo mesmo departamento, uma juíza federal concluiu que o Google tem o monopólio na publicidade online.
A decisão sobre o que deve ser feito ainda não saiu, mas o pedido das autoridades é que a empresa venda partes de sua plataforma de anúncios.
Como será o julgamento
O processo sobre o domínio do Google nas buscas foi aberto ainda em 2020, ainda no primeiro governo de Donald Trump. Os autores da ação são o Departamento de Justiça (DOJ) do governo federal e uma coalizão de 38 procuradores-gerais estaduais.
O julgamento deverá levar três semanas e será conduzido pelo juiz distrital Amit Mehta, em Washington.
Ele acontece no mesmo tribunal em que a Meta está enfrentando seu próprio julgamento antitruste sobre as compras do Instagram e do WhatsApp.
Entre as testemunhas de acusação estão representantes da OpenAI, dona do ChatGPT, e da Perplexity, que também é uma inteligência artificial que responde a buscas.
O que quer a acusação
No primeiro dia de julgamento, um advogado do Departamento de Justiça disse que serão necessárias medidas rigorosas para impedir que o Google use seus produtos de inteligência artificial para ampliar seu domínio na busca online.
As propostas do DOJ para o aumento da concorrência com o Google nas buscas incluem:
o fim dos acordos exclusivos nos quais a big tech paga bilhões de dólares anualmente à Apple e a outros fornecedores de dispositivos para tornar o Google o mecanismo de busca padrão em seus tablets e smartphones.
o licenciamento de resultados de pesquisa para os concorrentes.
a venda  do sistema operacional móvel Android, se outras medidas não conseguirem restaurar a concorrência.
O que diz o Google
A adoção dos remédios propostos pelo DOJ ""atrasaria a inovação norte-americana em um momento crítico"", disse a executiva do Google, Lee-Anne Mulholland, em um post no último domingo (20).
""Quando se trata de remédios antitruste, a Suprema Corte dos EUA disse que 'cautela é fundamental'. A proposta do DOJ joga essa cautela ao vento"", completou.
O Google argumenta que seus produtos de IA estão fora do escopo do caso, que se concentrou nos mecanismos de busca.
'Mil vezes melhor que celular': por que as câmeras Cyber-shot estão saindo da gaveta
O que é stalker e como perceber o crime",https://g1.globo.com/tecnologia/noticia/2025/04/21/google-enfrenta-julgamento-historico-por-monopolio-nas-buscas.ghtml,pt
Assista aos telejornais da TV Liberal,"Mon, 21 Apr 2025 22:50:27 -0000",Globo (Brazil),Brazil,Acompanhe diariamente a transmissão do Jornal Liberal 1ª e 2ª Edição. Assista aos telejornais da TV Liberal  Acompanhe diariamente a transmissão do Jornal Liberal 1ª e 2ª Edição.,https://g1.globo.com/pa/para/ao-vivo/assista-aos-telejornais-da-tv-liberal.ghtml,pt
Corpo de homem é encontrado com pés e mãos amarrados na Zona Sul de Teresina; vítima tinha marca de tiros,"Mon, 21 Apr 2025 22:47:53 -0000",Globo (Brazil),Brazil,"<img src=""https://s2-g1.glbimg.com/uHlv512QTWPtT2HWuLq8gKxGCy0=/i.s3.glbimg.com/v1/AUTH_59edd422c0c84a879bd37670ae4f538a/internal_photos/bs/2021/K/A/BuA198RNW2Np1lVuSf9w/whatsapp-image-2021-10-19-at-19.14.16.jpeg"" /><br />     A Polícia Militar (PM) informou que o homem estava sem documentos e que nenhum familiar apareceu para reconhecer o corpo, então até o momento não há identificação. Departamento de Homicídios e Proteção à Pessoa (DHPP), em Teresina, Piauí
Laura Moura /g1
O corpo de homem foi encontrado na tarde desta segunda-feira (21) na Estrada da Alegria, próximo ao Povoado Torrões, na Zona Sul de Teresina. Segundo a Polícia Militar (PM), ele estava com os pés e mãos amarrados e tinha marcas de tiro pelo corpo. 
✅ Siga o canal do g1 Piauí no WhatsApp
Ao g1, o sargento Valdeci, do 17º Batalhão da Polícia Militar (17º BPM), informou que o homem estava sem documentos e que nenhum familiar apareceu para reconhecer o corpo, então até o momento não há identificação.
A perícia da Polícia Civil foi ao local para investigar as causas da morte e a quanto tempo a vítima estava no local. O Departamento de Homicídio e Proteção à Pessoa (DHPP) segue com o caso. 
📲 Confira as últimas notícias do g1 Piauí
📲 Acompanhe o g1 Piauí no Facebook, no Instagram e no X
VÍDEOS: assista aos vídeos mais vistos da Rede Clube",https://g1.globo.com/pi/piaui/noticia/2025/04/21/corpo-de-homem-e-encontrado-com-pes-e-maos-amarrados-na-zona-sul-de-teresina-vitima-tinha-marca-de-tiros.ghtml,pt
Caso Jenife: corpo de brasileira morta na Bolívia vai ser sepultado no Amapá,"Mon, 21 Apr 2025 22:45:50 -0000",Globo (Brazil),Brazil,"<img src=""https://s2-g1.glbimg.com/f7xPF8FnBK4Y2rzobxwC1E6u-HA=/i.s3.glbimg.com/v1/AUTH_59edd422c0c84a879bd37670ae4f538a/internal_photos/bs/2025/X/x/lBS4zBQwyytVdDRvPfvw/manifestacao-jenife-78-.jpg"" /><br />     A família da brasileira Jenife Silva, de 37 anos, natural de Santana (AP), está na Bolívia para acompanhar os trâmites para do translado do corpo que deve acontecer na quarta-feira (23). 
O corpo da brasileira Jenife Silva passou por uma nova autópsia particular na última quarta-feira (16), na Bolívia. Esta foi a última etapa da família na Bolívia para os trâmites do translado de Santa Cruz de La Sierra para o sepultamento do corpo em Santana (AP).
✅ Clique aqui para seguir o canal do g1 AP no WhatsApp
A prima de Jenife, Cirlene Fernandes disse que a previsão é que o corpo chegue no município de Santana, cidade natal da vítima, até a quarta-feira (23), após quase 20 dias desde o assassinato.
""Essa despedida é só uma etapa, a gente vai continuar lutando por justiça, buscando essa verdade [...] A gente tem aquela sede de justiça pela verdade também, que o culpado pague pelo crime que cometeu, porque ele assassinou uma prima, uma sobrinha, uma amiga, uma irmã, uma filha e uma mãe, deixando dois filhos"", disse a representante da família no Amapá.
Prima de Jenife, Cirlene Fernandes, busca por justiça no caso
Isadora Pereira/g1
De acordo com as autoridades bolivianas, a mulher foi vítima de um feminicídio praticado por um adolescente de 16 anos. O adolescente se apresentou na delegacia e alegou ter uma relação próxima da vítima.
O que se sabe sobre brasileira assassinada na Bolívia
""A família ainda está na Bolívia , a irmã mais nova da Jenife e os dois tios. Graças a cada um de vocês que também ajudaram no pix solidário, eles vão voltar par o Brasil [...], assim como o translado do corpo da Jenife também será feito, disse Cirlene.
A investigações do caso ainda estão em andamento pelas autoridades da Bolívia e do Brasil. Todos os materiais coletados ainda estão em análise.
""A família está muito abalada, e nós queremos fazer o velório da Jenife, fazer esse enterro. Nós não temos a data do velório, ainda vai ser confirmado, mas assim que tivermos uma data prevista, a gente vai divulgar nas redes sociais para quem quiser prestar as últimas homenagens"", finalizou Cirlene.
Jenife Silva estava se formando em medicina
Reprodução/Redes sociais
OAB e Senado acompanham no caso
O advogado Cícero Bordalo Jr., presidente da Comissão de Combate ao Feminicídio da Ordem dos Advogados do Brasil no Amapá (OAB-AP), acompanha o caso, em Brasília.
""Estive no Itamaraty e fiz alguns requerimentos. Amanhã irei fazer contato com o membro da Corte Interamericana de Direitos Humanos [...] Reunirei com os representantes do Itamaraty e das embaixadas brasileiras que ficam na Bolívia para que nós possamos acelerar e melhorar essa investigação"", disse Bordalo. 
O senador Randolfe Rodrigues (PT), apresentou um requerimento que foi aprovado no Congresso Nacional que institui uma Comissão Temporária Externa. Essa comissão deve investigar o caso de Jenife e apurar as condições enfrentadas por outros brasileiros que vivem na Bolívia. 
""Para tomar as medidas necessárias, primeiro para a repatriação do corpo de Jenife ao Brasil aos seus familiares, em segundo lugar para a culpabilização dos culpados. Mas parece que o caso de Jenife traz uma segunda situação, que é a situação de uma comunidade de mais de 6 mil brasileiros que estudam medicina em Santa Cruz de La Sierra"", disse Randolfe. 
OAB Amapá cria comissão para enfrentar o crime de feminicídio no Amapá
Relembre o caso 
A brasileira Jenife Silva, de 37 anos, natural de Santana (AP), foi encontrada morta em seu apartamento na quarta-feira (2) na Zona Norte de Santa Cruz de La Sierra, na Bolívia. Segundo o que foi passado pela polícia boliviana, Jenife morreu estrangulada, além de ter sofrido estupro e esfaqueamento.
Uma amiga da vítima esclareceu que Jenife tinha terminado o curso de medicina em Santa Cruz, onde residiu por 6 anos, e já estava morando novamente no Amapá. A vítima retornou à Bolívia para buscar o diploma do curso.
Em seu depoimento, o suspeito disse que durante relações sexuais com Jenife, ela sofreu um mal súbito e o mesmo fugiu em seguida.
Caso Jenife Silva: protesto reuniu população em Santana em busca de justiça
LEIA MAIS
Família de brasileira encontrada morta na Bolívia pede justiça: ‘Jenife foi em busca do sonho dela’
Comissão de Combate ao Feminicídio da OAB-AP acompanha caso de brasileira morta na Bolívia 
'Lutar para que ninguém mais tenha que sentir isso', diz filha de 11 anos de brasileira assassinada na Bolívia
Tem uma sugestão de pauta? Fale com o g1 no WhatsApp
📲 Siga as redes sociais do g1 Amapá e Rede Amazônica: Instagram e Facebook
📲 Receba no WhatsApp as notícias do g1 Amapá
Veja o plantão de últimas notícias do g1 Amapá
VÍDEOS com as notícias do Amapá:",https://g1.globo.com/ap/amapa/noticia/2025/04/21/caso-jenife-corpo-de-brasileira-morta-na-bolivia-vai-ser-sepultado-no-amapa.ghtml,pt
"Rifas para viagem, descanso na praia e escalada para conseguir enxergar: jovem relembra desafios antes de receber bênção do papa","Mon, 21 Apr 2025 22:41:05 -0000",Globo (Brazil),Brazil,"Catequista de Hortolândia conseguiu viajar para ver o religioso após comunidade fazer rifas e bingo. Também dormiu na praia e se equilibrou em estrutura para ter vista privilegiada. Catequista de Hortolândia relata emoção ao acompanhar visita do papa ao Brasil em 2013
Um catequista de Hortolândia, no interior de São Paulo, dormiu na praia e chegou a se equilibrar sobre uma estrutura para conseguiu ver o papa Francisco no Brasil, em 2013, após conseguir dinheiro para a viagem com rifas e bingo. O esforço teve resultado e ele foi agraciado com uma bênção.
Papa Francisco morreu na madrugada desta segunda-feira (21), no horário de Brasília, de AVC e insuficiência cardíaca. 
'Muito emocionante', diz casal de Limeira que presenciou última bênção do papa
AO VIVO: Acompanhe a repercussão da morte do papa
Em 2013, George Paulo da Silva estava com 31 anos e participava do grupo de jovens da Paróquia São Marcos. Ele e os demais jovens se juntaram para arrecadar o dinheiro para a viagem ao Rio de Janeiro, na Jornada Mundial da Juventude. 
Eles fizeram rifas, pastel e bingo e conseguiram o valor. Aproximadamente 20 jovens foram para a viagem. 
Moradores de Limeira e Hortolândia relembram contatos com papa Francisco
Vista privilegiada e bênção
George contou que, além de dormirem na praia para não perderem lugar na passagem do papa pela região, ele precisou improvisar para ter uma vista privilegiada. 
""Ele estava vindo no papa móvel e na minha frente tinha muita gente, e eu não tinha uma visão privilegiada. E tinha uma estrutura. Não lembro se era uma árvore ou estrutura de ferro. E eu subi nessa estrutura com a câmera ligada para filmar. Na hora que o papa Francisco passou, eu tenho a nítida imagem que ele olhou para mim, deu a bênção e passou, e eu com a câmera na mão. Só que depois, no final, na hora que eu fui ver eu não tinha nem apertado o botão para gravar de tanta emoção"", relembra.
Ele classifica o momento como ""surreal"". ""É muita emoção. Você vê o amor passando na sua frente. E é aquele amor que contagia você"".
'A partir de agora é com vocês'
O catequista relembra o momento que mais lhe marcou nas mensagens transmitidas por Francisco durante a viagem.
""Eu acho que o que mais causou impacto [do que ele disse] foi de ser missionário. Ele falou: 'a partir de agora é com vocês. O papa esteve aqui, conversou com todos vocês e, a partir de agora, a continuidade de tudo isso vai partir de cada um de vocês, na paróquia de cada um de vocês, na comunidade de cada um de vocês'. Então, essa acredito que seja a grande mensagem. O papa está lá em Roma, mas aqui no São Marcos é nós que temos que fazer as coisas acontecerem"", interpreta.
Papa Francisco deixa legado de transformação na Igreja Católica
VÍDEOS: tudo sobre Campinas e região
8
Veja mais notícias sobre a região no g1 Campinas",https://g1.globo.com/sp/campinas-regiao/noticia/2025/04/21/olhou-para-mim-deu-a-bencao-e-passou-diz-jovem-do-interior-de-sp-que-acompanhou-visita-do-papa-ao-brasil.ghtml,pt
Assista aos telejornais da TV Bahia,"Mon, 21 Apr 2025 22:39:30 -0000",Globo (Brazil),Brazil,Assista aos telejornais da TV Bahia,https://g1.globo.com/ba/bahia/ao-vivo/assista-aos-telejornais-da-tv-bahia.ghtml,pt
Assista aos telejornais da TV Gazeta de Alagoas,"Mon, 21 Apr 2025 22:38:34 -0000",Globo (Brazil),Brazil,Assista aos telejornais da TV Gazeta de Alagoas,https://g1.globo.com/al/alagoas/ao-vivo/assista-aos-telejornais-da-tv-gazeta-de-alagoas.ghtml,pt
Assista aos telejornais da TV Subaé,"Mon, 21 Apr 2025 22:38:32 -0000",Globo (Brazil),Brazil,Assista aos telejornais da TV Subaé,https://g1.globo.com/ba/feira-de-santana-regiao/ao-vivo/assista-aos-telejornais-da-tv-subae.ghtml,pt
Assista ao Boa Noite Espírito Santo,"Mon, 21 Apr 2025 22:38:13 -0000",Globo (Brazil),Brazil,"<img src=""https://s2-g1.glbimg.com/t6wDTJhkEZH4oGMdnsLLCTXWPgk=/i.s3.glbimg.com/v1/AUTH_59edd422c0c84a879bd37670ae4f538a/internal_photos/bs/2023/J/E/FWHo3WQAWAXmBOAgYPgA/boa-noite-es.png"" /><br />     As principais notícias do dia no Espírito Santo. Assista ao Boa Noite Espírito Santo As principais notícias do dia no Espírito Santo.",https://g1.globo.com/es/espirito-santo/ao-vivo/ao-vivo-assista-ao-boa-noite-espirito-santo.ghtml,pt
"Comerciante morre afogada após ser arrastada por correnteza no Rio Araguaia, dizem bombeiros","Mon, 21 Apr 2025 22:37:53 -0000",Globo (Brazil),Brazil,"<img src=""https://s2-g1.glbimg.com/BQCrNSRIzE8XXfvqyGSBKiPbFvI=/i.s3.glbimg.com/v1/AUTH_59edd422c0c84a879bd37670ae4f538a/internal_photos/bs/2025/I/Y/Z26ckKRjCSnkTGitKalw/design-sem-nome-3-.jpg"" /><br />     Mulher tinha costume de pescar no rio e postar nas redes sociais. Ela estava caminhando com o namorado em um banco de areia quando foi arrastada. Corpo de comerciante que se afogou no rio Araguaia é encontrado
A comerciante Nerica Mara Monteiro Loth, de 34 anos, morreu afogada depois de ser arrastada pela correnteza no Rio Araguaia, no município de São Miguel do Araguaia, no norte de Goiás. De acordo com o Corpo de Bombeiros, a mulher foi arrastada junto com o namorado na região conhecida como Rancho da Viúva.
✅ Clique e siga o canal do g1 GO no WhatsApp
O Corpo de Bombeiros disse que a mulher desapareceu nas águas do rio no domingo (20), e os familiares chamaram a equipe de resgate. Ainda segundo os socorristas, pessoas que estavam no local conseguiram resgatar o rapaz com o auxílio de uma embarcação, mas a namorada dele acabou sendo levada. O corpo dela foi encontrado nesta segunda-feira (21).
De acordo com o Corpo de Bombeiros, o corpo da comerciante foi encontrado por populares que ajudaram nas buscas a sete quilômetros do local onde Nérica foi vista pela última vez. 
Nérica morava em Hidrolândia, na Região Metropolitana de Goiânia.
Nerica Monteiro
Reprodução/Instagram
LEIA TAMBÉM:
Mãe de menino de 3 anos que morreu afogado em resort diz que está destruída: ‘Meu tudo’
Adolescente morre afogado ao tentar salvar irmão em barragem de rio, dizem bombeiros
Jovem morre afogado em lago dentro de condomínio
Ainda segundo a TV Anhanguera, Nérica estava pescando com amigos na região da Viúva. Nas redes sociais, a comerciante tinha costume de postar vídeos de pescaria no rio Araguaia. 
No domingo à tarde, ela estava caminhando com o namorado em um banco de areia dentro do rio quando acabou caindo numa parte mais funda e foi arrastada pela correnteza. Bombeiros e o Batalhão Ambiental da Polícia Militar fizeram buscas com a ajuda de mergulhadores de Goiânia.
Corpo de Bombeiros faz busca por Nérica Monteiro, no rio Araguaia.
Divulgação/Corpo de Bombeiros
📱 Veja outras notícias da região no g1 Goiás.",https://g1.globo.com/go/goias/noticia/2025/04/21/mulher-morre-afogada-apos-ser-arrastada-por-correnteza-no-rio-araguaia-dizem-bombeiros.ghtml,pt
Assista ao Bom Dia Rio Grande,"Mon, 21 Apr 2025 22:37:44 -0000",Globo (Brazil),Brazil,"Assista ao Bom Dia Rio Grande  O g1 transmite ao vivo, de segunda a sexta, os telejornais da RBS TV: Bom Dia Rio Grande, Jornal do Almoço e RBS Notícias. . Aos sábados, temos transmissão ao vivo também do Jornal do Almoço e do RBS Notícias.. Acompanhe o canal do g1 RS no WhatsApp",https://g1.globo.com/rs/rio-grande-do-sul/ao-vivo/assista-ao-vivo-aos-telejornais-da-rbs-tv.ghtml,pt
EPTV2 - Ribeirão e Franca,"Mon, 21 Apr 2025 22:37:42 -0000",Globo (Brazil),Brazil,"<img src=""https://s2-g1.glbimg.com/4nJ1rXm8Nk5tISd6_Cqg47RgRtY=/i.s3.glbimg.com/v1/AUTH_59edd422c0c84a879bd37670ae4f538a/internal_photos/bs/2020/V/h/hFmDSxS6m7LBBPA0SAlg/still0418-00010.jpg"" /><br />     Transmissão encerrada. EPTV2 - Ribeirão e Franca Transmissão encerrada.",https://g1.globo.com/sp/ribeirao-preto-franca/ao-vivo/eptv-2-ribeirao-e-franca-ao-vivo.ghtml,pt
